"","Combo","BB_Result","FX_Result","UB_Result","VT_Result","AA_Result","Total_Result"
"1","Simone Biles, Jade Carey, Shilese Jones, Konnor McClain, Zoe Miller",2.761,2.98,0.921,2.719,3.557,12.938
"2","Simone Biles, Jade Carey, Shilese Jones, Konnor McClain, Kaliya Lincoln",2.761,3.148,0.631,2.719,3.557,12.816
"3","Simone Biles, Jade Carey, Shilese Jones, Konnor McClain, Skye Blakely",2.761,2.98,0.631,2.719,3.557,12.648
"4","Simone Biles, Shilese Jones, Konnor McClain, Kaliya Lincoln, Zoe Miller",2.761,3.148,0.921,2.2,3.557,12.587
"5","Simone Biles, Jade Carey, Konnor McClain, Kaliya Lincoln, Zoe Miller",2.761,3.148,0.418,2.719,3.465,12.511
